{
   "$schema": "https://json-schema.org/draft/2020-12/schema",
   "$id": "concesionario.schema.json",

   "title": "Concesionario",
   "description": "Ventas de un concesinario",

   "type": "object",
   "properties": {
      "concesionario": {
         "description": "Nombre del concesionario",
         "type": "string"
      },
      "clientes": {
         "description": "Lista de clientes",
         "type": "array",
         "items": {
            "description": "Cliente del concesionario",
            "$ref": "#/$defs/persona"
         }
      },
      "modelos": {
         "description": "Lista de modelos de la marca",
         "type": "array",
         "items": {"$ref": "#/$defs/modelo"}
      },
      "coches": {
         "descripcion": "Coches para la venta",
         "type": "array",
         "items": {"$ref": "#/$defs/coche"}
      }
   },
   "required": ["concesionario"],
   "additionalProperties": false,

   "$defs": {
      "persona": {
         "type": "object",
         "properties": {
            "id": {"$ref": "#/$defs/identificador"},
            "dni": {
               "type": "string",
               "pattern": "^[0-9]{8}[A-Z]$"
            },
            "nombre": {
               "type": "string"
            },
            "direccion": {"$ref": "#/$defs/direccion"}
         },
         "required": ["id", "nombre"],
         "additionalProperties": false
      },
      "direccion": {
         "description": "Dirección postal",
         "type": "object",
         "properties": {
            "domicilio": { "type": "string" },
            "cp": { "type": "integer" },
            "poblacion": { "type": "string" }
         },
         "required": ["domicilio", "cp", "poblacion"],
         "additionalProperties": false
      },
      "identificador": {
         "type": "integer",
         "minimum": 1
      },
      "modelo": {
         "type": "object",
         "additionalProperties": false,
         "required": ["id", "nombre"],
         "properties": {
            "id": {"$ref": "#/$defs/identificador"},
            "nombre": {"type": "string"},
            "cilindrada": {
               "type": "integer",
               "minimum": 1
            },
            "cv": {
               "type": "integer",
               "minimum": 1
            },
            "velmax": {
               "type": "integer",
               "minimum": 1
            },
            "plazas": {
               "type": "integer",
               "minimum": 1
            }
         }
      },
      "coche": {
         "description": "Coche en venta. Nuevo no puede tener 'km'; km0, puede pero no más de 100; '2mano' debe tenerlos.",
         "type": "object",
         "unevaluatedProperties": false,
         "required": ["id", "modelo", "tipo"],
         "properties": {
            "id": {"$ref": "#/$defs/identificador"},
            "modelo": {"$ref": "#/$defs/identificador"},
            "reservado": {
               "description": "Cliente que reserva el coche o false",
               "default": false,
               "oneOf": [
                  {"$ref": "#/$defs/identificador"},
                  {"const": false}
               ]
            }
         },
         "oneOf": [
            {
               "properties": {
                  "tipo": { "const": "2mano" },
                  "km": {"type": "integer", "minimum": 0}
               },
               "required": ["km"]
            },
            {
               "properties": {
                  "tipo": { "const": "nuevo" }
               }
            },
            {
               "properties": {
                  "tipo": {"const": "km0"},
                  "km": {"type": "integer", "minimum": 0, "maximum": 100}
               }
            }
         ]
      }
   }
}
