{
   "concesionario": "SEAT",
   "clientes": [
      {
         "id": 1,
         "dni": "12345678Z",
         "nombre": "Perico de los Palotes",
         "direccion": {
            "domicilio": "c/ AAAAA, 22",
            "cp": 12345,
            "poblacion": "Villaarriba"
         }
      },
      {
         "id": 2,
         "dni": "012345678L",
         "nombre": "María Bermudo",
         "direccion": {
            "domicilio": "c/ BBBBB, 21",
            "cp": 54321,
            "poblacion": "Villaabajo"
         }
      }
   ],
   "modelos": [
      {
         "id": 1,
         "nombre": "León",
         "cilindrada": 2000,
         "cv": 140,
         "velmax": 220,
         "plazas": 5
      },
      {
         "id": 2,
         "nombre": "Ibiza",
         "cilindrada": 1800,
         "cv": 120,
         "velmax": 200,
         "plazas": 5
      }
   ],
   "coches": [
      {
         "id": 1,
         "modelo": 1,
         "tipo": "nuevo",
         "reservado": 1
      },
      {
         "id": 2,
         "modelo": 1,
         "tipo": "2mano",
         "km": 50000
      },
      {
         "id": 3,
         "modelo": 2,
         "tipo": "km0"
      },
      {
         "id": 4,
         "modelo": 2,
         "tipo": "2mano",
         "km": 132000,
         "reservado": 2
      }
   ]
}
